{
  "$schema": "./course.schema.json",
  "schemaVersion": 1,
  "id": "llm-engineering-professional",
  "title": "Professional Program in LLM Engineering and Agentic AI",
  "shortTitle": "LLM Engineer",
  "language": "en",
  "description": "An applied path to design, build, evaluate, and operate production LLM systems, demonstrate competence through a capstone, and prepare for professional certifications.",
  "sourceRepository": "jlcases/llm-engineering-program",
  "canonicalSite": "https://llmengineerclub.com/en/",
  "reviewedAt": "2026-08-21",
  "durationHours": { "min": 250, "max": 300 },
  "ects": 10,
  "outcomes": [
    "Integrate OpenAI, Anthropic, and Amazon Bedrock models behind provider-neutral, observable contracts.",
    "Design prompts, tools, and structured outputs evaluated with reproducible datasets.",
    "Build and measure RAG systems across retrieval, reranking, grounding, and continuous evaluation.",
    "Orchestrate reliable agents with LangGraph, MCP, memory, traces, and safety boundaries.",
    "Operate LLM applications with observability, cost controls, deployment, and governance.",
    "Defend a production-grade capstone with evidence, metrics, and architectural decisions.",
    "Prepare for AWS Certified AI Practitioner and NVIDIA-Certified Associate Generative AI LLMs."
  ],
  "competencies": [
    { "id": "foundations", "label": "Foundations and models", "description": "Explain transformers, tokenization, inference, and model selection through explicit trade-offs.", "evidence": "An executable comparison and a model decision backed by evaluation." },
    { "id": "prompt-systems", "label": "Prompt systems", "description": "Treat prompts, schemas, and tools as versioned, testable contracts.", "evidence": "A regression dataset and A/B pipeline with explicit criteria." },
    { "id": "retrieval", "label": "RAG and retrieval", "description": "Design ingestion, chunking, search, reranking, grounding, and RAG evaluation.", "evidence": "A measured RAG system with answerable and unanswerable cases, citations, and retrieval metrics." },
    { "id": "agents", "label": "Agents and MCP", "description": "Build graphs, tools, memory, and failure recovery without losing control.", "evidence": "An agent with three tools, traces, idempotency, and negative-path tests." },
    { "id": "evaluation", "label": "Evaluation", "description": "Separate model, retrieval, and application quality through reproducible evaluations.", "evidence": "A regression suite with a baseline, rubric, failed samples, and acceptance gates." },
    { "id": "operations", "label": "LLMOps", "description": "Observe latency, cost, quality, safety, and distribution shifts in production.", "evidence": "An operational dashboard, alerts, and an incident runbook." },
    { "id": "security", "label": "Safety and governance", "description": "Model threats, constrain tools, and apply privacy, guardrails, and auditability.", "evidence": "A threat model, prompt-injection test, and verifiable controls." },
    { "id": "architecture", "label": "Product architecture", "description": "Make build-vs-buy, cost, reliability, and user-experience decisions.", "evidence": "ADRs, cost analysis, and a technical capstone defense." }
  ],
  "modules": [
    { "id": "module-01", "number": 1, "slug": "llm-foundations", "sourceSlug": "fundamentos-llm", "path": "modulo-01-fundamentos-llm", "title": "LLM Foundations and APIs", "shortTitle": "Foundations", "description": "Transformers, tokenization, generation, current models, and multi-provider clients.", "durationHours": { "min": 15, "max": 18 }, "ects": 0.5, "prerequisites": [], "competencies": ["foundations", "architecture"], "milestone": "A multi-provider client with observable tokens, latency, errors, and metadata." },
    { "id": "module-02", "number": 2, "slug": "prompt-engineering", "sourceSlug": "prompt-engineering", "path": "modulo-02-prompt-engineering", "title": "Advanced Prompt Engineering", "shortTitle": "Prompt systems", "description": "Prompts as software: tools, structured outputs, evaluation, versioning, and mitigation.", "durationHours": { "min": 38, "max": 45 }, "ects": 1.5, "prerequisites": ["module-01"], "competencies": ["prompt-systems", "evaluation", "security"], "milestone": "A prompt-evaluation pipeline with a dataset, A/B tests, and regression gates in CI." },
    { "id": "module-03", "number": 3, "slug": "rag", "sourceSlug": "rag", "path": "modulo-03-rag", "title": "RAG Systems and Evaluation", "shortTitle": "RAG", "description": "Ingestion, embeddings, vector stores, chunking, reranking, grounding, and RAGAS.", "durationHours": { "min": 50, "max": 60 }, "ects": 2, "prerequisites": ["module-01", "module-02"], "competencies": ["retrieval", "evaluation", "architecture"], "milestone": "A RAG application with citations, abstention, and automated evaluation." },
    { "id": "module-04", "number": 4, "slug": "agents", "sourceSlug": "agentes", "path": "modulo-04-agentes", "title": "AI Agents and Orchestration", "shortTitle": "Agents", "description": "Agentic patterns, LangGraph, MCP, tool use, multi-agent systems, memory, and evaluation.", "durationHours": { "min": 50, "max": 60 }, "ects": 2, "prerequisites": ["module-01", "module-02"], "competencies": ["agents", "evaluation", "security"], "milestone": "A multi-agent system with an MCP server, traces, and failure recovery." },
    { "id": "module-05", "number": 5, "slug": "llmops", "sourceSlug": "llmops", "path": "modulo-05-llmops", "title": "LLMOps, Production, and Responsible AI", "shortTitle": "LLMOps", "description": "Observability, continuous evaluation, cost, deployment, security, safety, and governance.", "durationHours": { "min": 50, "max": 60 }, "ects": 2, "prerequisites": ["module-03", "module-04"], "competencies": ["operations", "evaluation", "security", "architecture"], "milestone": "A deployed system with SLOs, costs, evaluations, and an operational runbook." },
    { "id": "module-06", "number": 6, "slug": "capstone", "sourceSlug": "capstone", "path": "modulo-06-capstone", "title": "Production Capstone", "shortTitle": "Capstone", "description": "End-to-end project, technical portfolio, deployment, defense, and final preparation.", "durationHours": { "min": 47, "max": 57 }, "ects": 2, "prerequisites": ["module-03", "module-04", "module-05"], "competencies": ["foundations", "prompt-systems", "retrieval", "agents", "evaluation", "operations", "security", "architecture"], "milestone": "An interview-ready system with architecture, metrics, costs, and a live demo." }
  ],
  "certifications": [
    {
      "id": "aws-aif-c01", "name": "AWS Certified AI Practitioner", "code": "AIF-C01", "officialUrl": "https://docs.aws.amazon.com/aws-certification/latest/ai-practitioner-01/ai-practitioner-01.html", "verifiedAt": "2026-08-21", "sourcePath": "certificaciones/aws-aif-c01",
      "exam": { "durationMinutes": 90, "questions": 65, "scoredQuestions": 50, "passingScaledScore": 700 },
      "domains": [
        { "id": "aws-d1", "label": "Fundamentals of AI and ML", "weight": 20, "modules": ["module-01"] },
        { "id": "aws-d2", "label": "Fundamentals of Generative AI", "weight": 24, "modules": ["module-01", "module-02", "module-03"] },
        { "id": "aws-d3", "label": "Applications of Foundation Models", "weight": 28, "modules": ["module-02", "module-03", "module-04"] },
        { "id": "aws-d4", "label": "Guidelines for Responsible AI", "weight": 14, "modules": ["module-02", "module-05"] },
        { "id": "aws-d5", "label": "Security, Compliance, and Governance", "weight": 14, "modules": ["module-05"] }
      ]
    },
    {
      "id": "nvidia-nca-genl", "name": "NVIDIA-Certified Associate: Generative AI LLMs", "code": "NCA-GENL", "officialUrl": "https://www.nvidia.com/en-us/learn/certification/generative-ai-llm-associate/", "verifiedAt": "2026-08-21", "sourcePath": "certificaciones/nvidia-nca-genl",
      "exam": { "durationMinutes": 60, "questionsMin": 50, "questionsMax": 60, "validityYears": 2 },
      "domains": [
        { "id": "nvidia-d1", "label": "Core Machine Learning and AI Knowledge", "weight": 30, "modules": ["module-01", "module-02", "module-04"] },
        { "id": "nvidia-d2", "label": "Software Development", "weight": 24, "modules": ["module-02", "module-03", "module-04", "module-05"] },
        { "id": "nvidia-d3", "label": "Experimentation", "weight": 22, "modules": ["module-02", "module-03", "module-05"] },
        { "id": "nvidia-d4", "label": "Data Analysis and Visualization", "weight": 14, "modules": ["module-01", "module-03", "module-05"] },
        { "id": "nvidia-d5", "label": "Trustworthy AI", "weight": 10, "modules": ["module-04", "module-05"] }
      ]
    }
  ],
  "publishing": {
    "include": ["README.md", "PLAN_DE_ESTUDIOS.md", "modulo-*/README.md", "modulo-*/teoria/*.md", "modulo-*/labs/*.py", "modulo-*/ejercicios.md", "modulo-*/proyecto/README.md", "modulo-06-capstone/**/*.md", "certificaciones/**/*.md", "recursos/**/*.md", "setup/README.md"],
    "exclude": ["**/.DS_Store", "**/__pycache__/**", "**/.venv/**", "**/soluciones/**"]
  }
}
